 {"id":65, "ansa":"Inversion of Control (IoC) and Dependency Injection (DI).", "ansb":"Object-Oriented Programming (OOP) and Procedural Programming (PP).", "ansc":"Model-View-Controller (MVC) and Representational State Transfer (REST).", "ansd":"Data Access Object (DAO) and Application Programming Interface (API).", "category":"SPRING", "good_answer":"Inversion of Control (IoC) and Dependency Injection (DI).", "level":"EASY", "question":"What are the core principles of Spring Framework?", "explanation":"The core principles of the Spring Framework include: Dependency Injection (DI) / Inversion of Control (IoC): Allows objects to be configured and managed by an external container, promoting loose coupling. Aspect-Oriented Programming (AOP): Separates cross-cutting concerns from the main application logic, improving modularity. Modularity: Encourages modular design and development, enhancing reusability and maintainability of components. Abstraction: Provides abstractions for common tasks, simplifying development and improving code quality. "},
 {"id":66, "ansa":"Dependency Injection is a design pattern used to decouple objects and manage their dependencies externally.", "ansb":"Dependency Injection is a feature for managing database connections in Spring applications.", "ansc":"Dependency Injection is a method for querying databases using SQL statements.", "ansd":"Dependency Injection is a feature for defining user interfaces in Spring applications.", "category":"SPRING", "good_answer":"Dependency Injection is a design pattern used to decouple objects and manage their dependencies externally.", "level":"MEDIUM", "question":"What is Dependency Injection (DI) in Spring?", "explanation":"In Spring, Dependency Injection (DI) is a design pattern and a core principle that allows objects to be loosely coupled by externalizing the construction and management of their dependencies. Instead of a class creating its own dependencies, the dependencies are provided (or \"injected\") into the class by an external entity, typically a container such as the Spring IoC container. With DI in Spring, classes declare their dependencies through constructor injection, setter injection, or field injection. The Spring container is then responsible for instantiating objects and injecting their dependencies at runtime, based on configuration provided through XML, Java annotations, or Java-based configuration. DI promotes modularity, testability, and flexibility in the application design by decoupling components and enabling easier unit testing and swapping of implementations. It simplifies application development by removing the responsibility of managing dependencies from individual classes, making the codebase easier to maintain and extend."},
 {"id":67, "ansa":"@Autowired annotation is used for defining HTTP methods in Spring MVC controllers.", "ansb":"@Autowired annotation is used for injecting dependencies automatically into Spring beans.", "ansc":"@Autowired annotation is used for configuring database connections in Spring applications.", "ansd":"@Autowired annotation is used for mapping request parameters to method parameters in Spring MVC controllers.", "category":"SPRING", "good_answer":"@Autowired annotation is used for injecting dependencies automatically into Spring beans.", "level":"MEDIUM", "question":"What is the purpose of @Autowired annotation in Spring?", "explanation":"The purpose of the `@Autowired` annotation in Spring is to automatically wire (or inject) dependencies into Spring-managed beans. When a bean is annotated with `@Autowired`, Spring will attempt to find a matching bean of the required type and inject it into the annotated field, constructor parameter, or method parameter. Using `@Autowired` eliminates the need for manual dependency injection configuration, as Spring handles the injection process automatically based on the application context. This simplifies the configuration and management of dependencies in Spring applications, promoting modularity, flexibility, and maintainability."},
 {"id":68, "ansa":"ApplicationContext is responsible for managing database transactions in Spring applications.", "ansb":"ApplicationContext is responsible for handling HTTP requests in Spring MVC applications.", "ansc":"ApplicationContext is responsible for initializing and configuring Spring beans.", "ansd":"ApplicationContext is responsible for generating HTML views in Spring applications.", "category":"SPRING", "good_answer":"ApplicationContext is responsible for initializing and configuring Spring beans.", "level":"MEDIUM", "question":"What is the role of ApplicationContext in Spring?", "explanation":"The `ApplicationContext` interface is a central interface in the Spring Framework that represents the Spring IoC container and provides access to various Spring beans and their configurations. Its role in Spring includes: - Bean Management: The `ApplicationContext` manages the lifecycle of Spring beans, including instantiation, initialization, and destruction. - Dependency Injection: It performs dependency injection by resolving and injecting dependencies into Spring beans based on their configurations. - Configuration Management: The `ApplicationContext` loads and manages bean configurations from various sources, such as XML files, Java annotations, and Java-based configuration classes. - Resource Access: It provides convenient access to resources such as files, URLs, and database connections within the application context. - Internationalization and Localization: The `ApplicationContext` supports internationalization and localization by managing message sources and resolving messages based on the current locale. - Event Handling: It supports event handling by publishing and subscribing to application events, allowing beans to react to lifecycle events and custom events. Overall, the `ApplicationContext` serves as the core container in Spring, providing essential functionalities for managing and configuring Spring beans, facilitating dependency injection, and supporting various aspects of application development."},
 {"id":69, "ansa":"Spring Boot is a tool for building web services in Python.", "ansb":"Spring Boot is a framework for developing mobile applications.", "ansc":"Spring Boot is an extension of the Spring Framework designed to simplify the development of Spring applications.", "ansd":"Spring Boot is a version control system for managing code changes in Spring projects.", "category":"SPRING", "good_answer":"Spring Boot is an extension of the Spring Framework designed to simplify the development of Spring applications.", "level":"EASY", "question":"What is Spring Boot?", "explanation":"Spring Boot is an open-source Java framework that simplifies the development of stand-alone, production-grade Spring-based applications. It provides pre-configured settings, auto-configuration, and a range of tools to quickly set up and run Spring applications with minimal configuration overhead."},
 {"id":70, "ansa":"@RestController annotation is used for configuring database connections in Spring applications.", "ansb":"@RestController annotation is used for defining HTTP request mappings and returning response bodies in Spring MVC controllers.", "ansc":"@RestController annotation is used for managing transactional behavior in Spring applications.", "ansd":"@RestController annotation is used for defining scheduled tasks in Spring applications.", "category":"SPRING", "good_answer":"@RestController annotation is used for defining HTTP request mappings and returning response bodies in Spring MVC controllers.", "level":"MEDIUM", "question":"What is the purpose of @RestController annotation in Spring MVC?", "explanation":"The purpose of the `@RestController` annotation in Spring MVC is to indicate that the annotated class is a RESTful controller. It combines the `@Controller` and `@ResponseBody` annotations, allowing for simplified creation of RESTful web services that return data directly in the response body without the need for a view resolver."},
 {"id":71, "ansa":"@RequestMapping annotation is used for specifying the data source in Spring applications.", "ansb":"@RequestMapping annotation is used for configuring exception handling in Spring MVC controllers.", "ansc":"@RequestMapping annotation is used for defining HTTP request mappings in Spring MVC controllers.", "ansd":"@RequestMapping annotation is used for defining transaction boundaries in Spring applications.", "category":"SPRING", "good_answer":"@RequestMapping annotation is used for defining HTTP request mappings in Spring MVC controllers.", "level":"EASY", "question":"What is the purpose of @RequestMapping annotation in Spring MVC?", "explanation":"The `@RequestMapping` annotation in Spring MVC is used to map HTTP requests to handler methods in controllers. It allows developers to define the URL patterns (or request mappings) for handling incoming requests and specify the HTTP methods (such as GET, POST, PUT, DELETE) that each handler method can process. This annotation provides a flexible and powerful mechanism for routing requests to the appropriate controller methods based on the request URL and method."},
 {"id":72, "ansa":"Spring Data JPA is a module of Spring Framework used for building web applications.", "ansb":"Spring Data JPA is a library for interacting with relational databases using Java Persistence API (JPA).", "ansc":"Spring Data JPA is a tool for managing dependencies in Spring applications.", "ansd":"Spring Data JPA is a framework for developing RESTful APIs in Spring Boot applications.", "category":"SPRING", "good_answer":"Spring Data JPA is a library for interacting with relational databases using Java Persistence API (JPA).", "level":"EASY", "question":"What is Spring Data JPA?", "explanation":"Spring Data JPA is a part of the larger Spring Data project, which aims to simplify data access in Spring-based applications. Specifically, Spring Data JPA provides a higher-level abstraction for working with Java Persistence API (JPA) implementations, such as Hibernate, EclipseLink, or OpenJPA. The purpose of Spring Data JPA is to reduce the amount of boilerplate code required to interact with databases using JPA. It achieves this by generating repository implementations at runtime based on interfaces defined by the developer. These repositories provide common CRUD (Create, Read, Update, Delete) operations and additional query methods, making it easier to work with persistent data in a database. Spring Data JPA also integrates with other Spring technologies, such as Spring MVC and Spring Boot, to provide seamless data access capabilities in Spring-based applications. It simplifies tasks such as pagination, sorting, and dynamic query creation, allowing developers to focus more on application logic rather than low-level data access details."},
 {"id":73, "ansa":"@Transactional annotation is used for specifying the data source in Spring applications.", "ansb":"@Transactional annotation is used for configuring exception handling in Spring MVC controllers.", "ansc":"@Transactional annotation is used for defining transaction boundaries in Spring applications.", "ansd":"@Transactional annotation is used for defining HTTP request mappings in Spring MVC controllers.", "category":"SPRING", "good_answer":"@Transactional annotation is used for defining transaction boundaries in Spring applications.", "level":"MEDIUM", "question":"What is the purpose of @Transactional annotation in Spring?", "explanation":"The `@Transactional` annotation in Spring is used to define the scope of a single database transaction. When applied to a method or class, it instructs Spring to manage transactions for that method or all methods within the class. The purpose of the `@Transactional` annotation is to ensure that a series of database operations are executed atomically, meaning either all of them succeed or none of them do. If an exception occurs during the execution of a transactional method, Spring will automatically roll back the transaction, reverting any changes made to the database to its previous state. By using `@Transactional`, developers can declaratively define transaction boundaries in their code without having to manage transactions manually. This helps to simplify the codebase, improve maintainability, and ensure data integrity in Spring applications."},
 {"id":74, "ansa":"Spring Security is a tool for managing dependencies in Spring applications.", "ansb":"Spring Security is a module of Spring Framework used for building web applications.", "ansc":"Spring Security is a library for interacting with relational databases using Java Persistence API (JPA).", "ansd":"Spring Security is a framework for managing user authentication and authorization in Spring applications.", "category":"SPRING", "good_answer":"Spring Security is a framework for managing user authentication and authorization in Spring applications.", "level":"MEDIUM", "question":"What is Spring Security?", "explanation":"Spring Security is a powerful and customizable authentication and access control framework for Java applications built on the Spring Framework. Its primary purpose is to provide comprehensive security features for securing Java applications, including web applications, RESTful services, and microservices. Key features and functionalities of Spring Security include: - Authentication - Authorization - Session Management - CSRF Protection - Security Headers - Password Encoding - Integration with Spring Framework Overall, Spring Security plays a crucial role in ensuring the security of Java applications by providing robust authentication, authorization, and access control mechanisms, helping developers build secure and reliable software systems."},
 {"id":75, "ansa":"@ComponentScan annotation is used for defining scheduled tasks in Spring applications.", "ansb":"@ComponentScan annotation is used for specifying the data source in Spring applications.", "ansc":"@ComponentScan annotation is used for scanning the packages to find and register Spring beans.", "ansd":"@ComponentScan annotation is used for configuring exception handling in Spring MVC controllers.", "category":"GIT", "good_answer":"@ComponentScan annotation is used for scanning the packages to find and register Spring beans.", "level":"EASY", "question":"What is the purpose of @ComponentScan annotation in Spring?", "explanation":"The `@ComponentScan` annotation in Spring is used to specify the base packages to scan for Spring-managed components such as `@Component`, `@Service`, `@Repository`, and `@Controller`. When Spring encounters this annotation in a configuration class (typically a class annotated with `@Configuration`), it automatically scans the specified packages and registers the found components in the Spring application context. The purpose of `@ComponentScan` is to enable automatic detection and registration of Spring components, reducing the need for explicit bean definitions in XML or Java configuration files. It promotes convention-over-configuration, allowing developers to focus on writing application logic rather than configuring every individual component. By using `@ComponentScan`, developers can ensure that their Spring components are discovered and managed by the Spring IoC container without needing to specify each component explicitly. This promotes modularity, flexibility, and maintainability in Spring-based applications."},
 {"id":76, "ansa":"Spring Batch is a tool for building web services in Python.", "ansb":"Spring Batch is a framework for developing batch processing applications in Spring.", "ansc":"Spring Batch is an extension of the Spring Framework designed to simplify the development of Spring applications.", "ansd":"Spring Batch is a version control system for managing code changes in Spring projects.", "category":"VARIOUS", "good_answer":"Spring Batch is a framework for developing batch processing applications in Spring.", "level":"MEDIUM", "question":"What is Spring Batch?", "explanation":"Spring Batch is a lightweight, comprehensive framework for building batch processing applications in Java. It provides reusable components and patterns for efficiently processing large volumes of data, such as ETL (Extract, Transform, Load) processes, data migrations, and report generation. Key features of Spring Batch include: - Chunk-oriented processing: Spring Batch processes data in chunks, allowing for efficient handling of large datasets by reading, processing, and writing data in manageable chunks. - Declarative I/O: Spring Batch provides abstractions for reading input data, processing it, and writing output data, making it easy to configure and manage complex data processing workflows. - Transactional processing: Spring Batch ensures transactional integrity during batch processing, allowing for rollback and recovery in case of errors or failures. - Parallel processing: Spring Batch supports parallel processing of batch jobs, enabling concurrent execution of multiple tasks to improve performance and scalability. -Job scheduling: Spring Batch integrates with Spring's task scheduling capabilities, allowing batch jobs to be scheduled and executed automatically at predefined intervals or on demand. Overall, Spring Batch simplifies the development of batch processing applications by providing reusable components, declarative configurations, and built-in support for common batch processing tasks. It is widely used in enterprise environments for processing large volumes of data reliably and efficiently."},
 {"id":77, "ansa":"@PathVariable annotation is used for defining HTTP request mappings in Spring MVC controllers.", "ansb":"@PathVariable annotation is used for handling request parameters in Spring MVC controllers.", "ansc":"@PathVariable annotation is used for injecting dependencies into Spring beans.", "ansd":"@PathVariable annotation is used for configuring database connections in Spring applications.", "category":"SQL", "good_answer":"@PathVariable annotation is used for handling request parameters in Spring MVC controllers.", "level":"HARD", "question":"What is the purpose of @PathVariable annotation in Spring MVC?", "explanation":"The purpose of the @PathVariable annotation in Spring MVC is to extract values from URI template patterns in the request URL and map them to method parameters in controller handler methods.\\n For example, in a RESTful API, if you have a URL pattern like /api/users/{userId}, you can use @PathVariable to extract the userId value from the URL and pass it as a parameter to the controller method."},
 {"id":78, "ansa":"Spring AOP is a module of Spring Framework used for building web applications.", "ansb":"Spring AOP is a library for interacting with relational databases using Java Persistence API (JPA).", "ansc":"Spring AOP is a framework for managing user authentication and authorization in Spring applications.", "ansd":"Spring AOP is a framework for aspect-oriented programming in Spring.", "category":"GIT", "good_answer":"Spring AOP is a framework for aspect-oriented programming in Spring.", "level":"MEDIUM", "question":"What is Spring AOP?", "explanation":"Spring AOP (Aspect-Oriented Programming) in the Spring Framework allows modularizing cross-cutting concerns, such as logging and security, from core business logic. It achieves this by defining aspects, which encapsulate such concerns, and applying them to specific points in the application's execution flow. Aspects are applied to join points, which are specific points in the application's execution, using advice. Pointcuts specify where aspects should be applied, and weaving integrates aspects with the target objects. This approach promotes modularity and maintainability by separating concerns."},
 {"id":79, "ansa":"Pagination is the process of dividing digital content into discrete pages.", "ansb":"Pagination is a technique for encrypting data in web applications.", "ansc":"Pagination is a method for optimizing the database through indexing.", "ansd":"Pagination is a design pattern used in object-oriented programming.", "category":"SQL", "good_answer":"Pagination is the process of dividing digital content into discrete pages.", "level":"HARD", "question":"What is pagination?", "explanation":"Pagination is a technique used in web development to split content into separate pages, improving user navigation and reducing loading times. It is crucial for enhancing the usability and performance of websites or applications that handle large datasets or content. You can read more searching for codewords like 'web pagination best practices', 'implementing pagination', or 'pagination user experience'."},
 {"id":80, "ansa":"Singleton scope, meaning the container creates a single instance of the bean.", "ansb":"Prototype scope, allowing for the creation of a new instance each time a bean is requested.", "ansc":"Request scope, specific to web applications, creating a new bean instance for each HTTP request.", "ansd":"Global-session scope, relevant only for global HTTP session in a portlet context.", "category":"SPRING", "good_answer":"Singleton scope, meaning the container creates a single instance of the bean.", "level":"MEDIUM", "question":"What scope can a bean have in Spring?", "explanation":"In Spring, a bean can have different scopes like singleton, prototype, request, session, and global-session. Singleton scope creates one instance per Spring IoC container, while prototype scope creates a new instance each time a bean is requested. Request and session scopes are specific to web applications, with new instances per HTTP request or session, respectively. Global-session scope is specific to portlet contexts."},
 {"id":81, "ansa":"Prototype scope, creating a new instance each time a bean is requested.", "ansb":"Request scope, creating a new bean instance for each HTTP request.", "ansc":"Singleton scope, creating only one instance of the bean per Spring IoC container.", "ansd":"Session scope, creating a new bean instance for each HTTP session.", "category":"SPRING", "good_answer":"Singleton scope, creating only one instance of the bean per Spring IoC container.", "level":"EASY", "question":"What is the default scope for Spring beans?", "explanation":"The default scope for Spring beans is singleton. This means the Spring IoC container creates only one instance of the bean, which is cached and all subsequent requests for that bean will return the cached object."},
 {"id":82, "ansa":"Yes, because the container handles synchronization for singleton beans.", "ansb":"No, the singleton scope does not guarantee thread safety by itself.", "ansc":"Yes, singleton beans are inherently thread-safe in Spring.", "ansd":"No, unless the bean is explicitly defined as thread-safe in its implementation.", "category":"SPRING", "good_answer":"No, the singleton scope does not guarantee thread safety by itself.", "level":"MEDIUM", "question":"Is a bean with Singleton scope thread-safe in a multi-threaded environment?", "explanation":"While the singleton scope ensures that only one instance of a bean is created, it does not handle the thread safety of the bean itself. The thread safety must be ensured by the developer through proper design and implementation, especially when bean's state is mutable or when it interacts with non-thread-safe resources."},
 {"id":83, "ansa":"A design pattern where a class requests dependencies from an external source rather than creating them.", "ansb":"A process where the application's classes are dependent on each other, reducing modularity.", "ansc":"A method of merging different pieces of code at runtime to enhance functionality.", "ansd":"A technique where classes are designed to rely solely on internal logic, avoiding external dependencies.", "category":"SPRING", "good_answer":"A design pattern where a class requests dependencies from an external source rather than creating them.", "level":"EASY", "question":"What is dependency injection?", "explanation":"Dependency injection is a design pattern used in programming and software design to achieve Inversion of Control (IoC). It allows a class to receive its dependencies from an external source (like a configuration file or runtime environment) rather than creating them internally. This promotes loose coupling and makes code more modular, easier to test, and maintain."},
 {"id":84, "ansa":"Constructor injection, setter injection, and field injection; constructor injection is preferred.", "ansb":"Manual injection, automatic injection, and dynamic injection; automatic injection is preferred.", "ansc":"Static injection, instance injection, and interface injection; instance injection is preferred.", "ansd":"Direct injection, indirect injection, and provider injection; direct injection is preferred.", "category":"SPRING", "good_answer":"Constructor injection, setter injection, and field injection; constructor injection is preferred.", "level":"MEDIUM", "question":"What are the methods of dependency injection, and which one is preferred?", "explanation":"Spring supports several methods of dependency injection, including constructor injection, setter injection, and field injection. Constructor injection is generally preferred because it allows for the dependencies to be provided at the time of the bean's creation, ensuring that the bean is always in a fully initialized state. It also makes it easier to identify required dependencies and promotes immutability, which can enhance code reliability and thread-safety."},
