 {"id":50, "ansa":"The 'volatile' keyword is used to declare variables that cannot be modified after initialization.", "ansb":"The 'volatile' keyword is used to declare variables that are visible to multiple threads, ensuring that changes made by one thread are immediately visible to other threads.", "ansc":"The 'volatile' keyword is used to declare variables that are initialized with default values by the Java Virtual Machine.", "ansd":"The 'volatile' keyword is used to declare variables that are automatically garbage-collected by the Java Virtual Machine.", "category":"JAVA", "good_answer":"The 'volatile' keyword is used to declare variables that are visible to multiple threads, ensuring that changes made by one thread are immediately visible to other threads.", "level":"MEDIUM", "question":"What does the 'volatile' keyword mean in Java?", "explanation":"The `volatile` keyword in Java is used to indicate that a variable's value may be modified by multiple threads that are not necessarily synchronized. When a variable is declared as `volatile`, the Java memory model ensures that all threads see the most up-to-date value of the variable. This means that changes made by one thread to a `volatile` variable are immediately visible to other threads, ensuring consistency in a multi-threaded environment. However, `volatile` does not provide atomicity for compound actions (such as incrementing a counter), so additional synchronization mechanisms may still be required for certain operations."},
 {"id":51, "ansa":"The 'final' keyword applied to a class prevents the class from being subclassed.", "ansb":"The 'final' keyword applied to a method prevents the method from being overridden by subclasses.", "ansc":"The 'final' keyword applied to a field makes the field constant, meaning its value cannot be changed after initialization.", "ansd":"All of the above.", "category":"LINUX", "good_answer":"All of the above.", "level":"MEDIUM", "question":"What does the 'final' keyword mean when applied to classes, methods, and fields in Java?", "explanation":"The 'final' keyword in Java has different meanings depending on where it's applied: 1. Final Classes: When applied to a class, the 'final' keyword indicates that the class cannot be subclassed. It prevents other classes from extending it, making the class immutable and ensuring that its behavior cannot be changed by inheritance. 2. Final Methods: When applied to a method, the 'final' keyword indicates that the method cannot be overridden by subclasses. It prevents subclasses from providing a different implementation of the method, ensuring that the behavior of the method remains consistent across all subclasses. 3. Final Fields: When applied to a field (variable), the 'final' keyword indicates that the field's value cannot be changed once it has been initialized. It makes the field immutable, ensuring that its value remains constant throughout the object's lifetime. In summary, the 'final' keyword can be used to make classes, methods, and fields immutable or to prevent subclasses from modifying behavior or overriding methods."},
 {"id":52, "ansa":"The main method is static because it can be called by the JVM without creating an instance of the class.", "ansb":"The main method is static because it cannot access non-static members of the class.", "ansc":"The main method is static to improve performance and reduce memory consumption.", "ansd":"The main method is static to ensure thread safety.", "category":"JAVA", "good_answer":"The main method is static because it can be called by the JVM without creating an instance of the class.", "level":"MEDIUM", "question":"Why is the main method in Java static?", "explanation":"The `main` method in Java is declared as `static` for several reasons: 1. Entry Point: The `main` method serves as the entry point for a Java application. It is the starting point from which the Java Virtual Machine (JVM) begins executing the program. 2. No Instance Required: By declaring the `main` method as `static`, it can be invoked without requiring an instance of the class to be created. This allows the JVM to call the `main` method directly without needing to instantiate the class first. 3. Consistency: Making the `main` method `static` ensures consistency across all Java applications. It indicates that the method belongs to the class itself, rather than to instances of the class. 4. Accessibility: Declaring the `main` method as `static` allows it to be easily accessible and callable from outside the class, even before any objects of the class are created. Overall, declaring the `main` method as `static` simplifies the execution of Java applications and ensures that it can be invoked reliably as the entry point for program execution."},
 {"id":53, "ansa":"An error is a runtime issue that cannot typically be handled by the application, while an exception is a runtime issue that can be caught and handled by the application.", "ansb":"An error is a compile-time issue that must be resolved before running the application, while an exception is a runtime issue that can be caught and handled by the application.", "ansc":"An error is a runtime issue caused by logical mistakes in the program, while an exception is a runtime issue caused by external factors beyond the control of the programmer.", "ansd":"An error is a type of checked exception, while an exception is a type of unchecked exception.", "category":"JAVA", "good_answer":"An error is a runtime issue that cannot typically be handled by the application, while an exception is a runtime issue that can be caught and handled by the application.", "level":"MEDIUM", "question":"What is an error and an exception in Java?", "explanation":"In Java, both errors and exceptions are types of throwable objects, but they represent different types of problems that can occur during the execution of a program: 1. Error: - Errors in Java represent serious, unrecoverable problems that typically occur at runtime and are beyond the control of the application. - Errors are often caused by system-level issues or environmental problems, such as out-of-memory errors (`OutOfMemoryError`) or hardware failures. - Examples of common errors include `OutOfMemoryError`, `StackOverflowError`, and `VirtualMachineError`. - Applications usually cannot handle errors, and they typically result in termination of the program. 2. Exception: - Exceptions in Java represent exceptional conditions or errors that occur during the execution of a program, but they are recoverable. - Exceptions can occur for a variety of reasons, including incorrect input, invalid operations, or unexpected conditions. - Exceptions are categorized into two main types: checked exceptions and unchecked exceptions. - Checked exceptions are checked at compile-time and must be either caught or declared in a method's `throws` clause. - Unchecked exceptions (also known as runtime exceptions) do not need to be explicitly caught or declared. - Examples of common exceptions include `NullPointerException`, `ArrayIndexOutOfBoundsException`, and `FileNotFoundException`. - Applications can handle exceptions using try-catch blocks or by allowing them to propagate up the call stack. In summary, errors represent serious problems that usually cannot be recovered from, while exceptions represent recoverable problems that can be handled by the application."},
 {"id":54, "ansa":"A primary key is a column or a set of columns that uniquely identifies each row in a table.", "ansb":"A primary key is a column used for storing unique values in a table.", "ansc":"A primary key is a column used for storing foreign values in a table.", "ansd":"A primary key is a column used for indexing purposes in a table.", "category":"SQL", "good_answer":"A primary key is a column or a set of columns that uniquely identifies each row in a table.", "level":"EASY", "question":"What is a primary key in SQL?", "explanation":"In SQL, a primary key is a column or a set of columns that uniquely identifies each row (record) in a table. It serves as a unique identifier for each record and ensures that each row in the table can be uniquely identified. Key characteristics of a primary key: 1. Uniqueness: Each value in the primary key column(s) must be unique across all rows in the table. No two rows can have the same primary key value. 2. Not Null: The primary key column(s) cannot contain null values. Each row must have a value in the primary key column(s). 3. Uniquely Identifies Rows: The primary key uniquely identifies each row in the table. This means that no two rows can have the same combination of primary key values. 4. Indexed: Typically, a primary key is automatically indexed by the database management system (DBMS) for faster retrieval of data. By defining a primary key for a table, you ensure data integrity and facilitate efficient data retrieval and manipulation. It is a fundamental concept in relational database design and is used to establish relationships between tables (e.g., foreign keys)."},
 {"id":55, "ansa":"A foreign key is a column or a set of columns that refers to the primary key of another table, establishing a relationship between the two tables.", "ansb":"A foreign key is a column used for storing unique values in a table.", "ansc":"A foreign key is a column used for indexing purposes in a table.", "ansd":"A foreign key is a column used for sorting rows in a table.", "category":"SQL", "good_answer":"A foreign key is a column or a set of columns that refers to the primary key of another table, establishing a relationship between the two tables.", "level":"EASY", "question":"What is a foreign key in SQL?", "explanation":"In SQL, a foreign key is a column or a set of columns in a table that establishes a relationship with a primary key or a unique key in another table. It represents a referential constraint between two tables, enforcing the integrity of the data by ensuring that values in the foreign key column(s) match values in the primary key or unique key column(s) of the referenced table."},
 {"id":56, "ansa":"The SELECT statement is used to delete rows from a table based on specified conditions.", "ansb":"The SELECT statement is used to sort the rows in a table based on a specified column.", "ansc":"The SELECT statement is used to retrieve data from one or more tables in a database.", "ansd":"The SELECT statement is used to update rows in a table based on specified conditions.", "category":"SQL", "good_answer":"The SELECT statement is used to retrieve data from one or more tables in a database.", "level":"EASY", "question":"What is the SELECT statement used for in SQL?", "explanation":"In SQL, the SELECT statement is used to retrieve data from a database. It allows you to specify which columns of data you want to retrieve and which rows of data you want to include in the result set. The basic syntax of the SELECT statement is: SELECT column1, column2, ... FROM table_name WHERE condition; Overall, the SELECT statement is fundamental to querying data from a database and is used extensively in SQL queries to retrieve specific information as needed."},
 {"id":57, "ansa":"The WHERE clause is used to specify conditions for filtering rows before grouping, while the HAVING clause is used to specify conditions for filtering groups after grouping.", "ansb":"The WHERE clause is used to specify conditions for filtering groups after grouping, while the HAVING clause is used to specify conditions for filtering rows before grouping.", "ansc":"The WHERE clause is used to specify conditions for sorting rows in a table, while the HAVING clause is used to specify conditions for sorting groups.", "ansd":"There is no difference between WHERE and HAVING clauses in SQL.", "category":"SQL", "good_answer":"The WHERE clause is used to specify conditions for filtering rows before grouping, while the HAVING clause is used to specify conditions for filtering groups after grouping.", "level":"EASY", "question":"What is the difference between WHERE and HAVING clauses in SQL?", "explanation":"In SQL, both the WHERE and HAVING clauses are used to filter rows in a query, but they operate at different stages of the query execution and have different purposes: - WHERE Clause: The WHERE clause is used to filter rows before any grouping or aggregation takes place. It is applied to individual rows as they are being selected from the database table(s). The WHERE clause filters rows based on conditions applied to columns. It is typically used with SELECT, UPDATE, and DELETE statements to specify filtering criteria for the rows to be affected. - HAVING Clause: The HAVING clause is used to filter rows after the grouping of data has occurred, typically in conjunction with GROUP BY. It is applied to groups of rows resulting from the GROUP BY clause. The HAVING clause filters groups based on conditions applied to aggregated values (e.g., SUM, COUNT, AVG) calculated for each group. It is only used in SELECT statements that include a GROUP BY clause. In summary, the WHERE clause is used for row-level filtering before data is grouped, while the HAVING clause is used for group-level filtering after data has been grouped using GROUP BY."},
 {"id":58, "ansa":"The DELETE statement is used to remove all rows from a table, while the TRUNCATE statement is used to remove specific rows from a table based on specified conditions.", "ansb":"The DELETE statement is used to remove specific rows from a table based on specified conditions, while the TRUNCATE statement is used to remove all rows from a table.", "ansc":"The DELETE statement is used to remove specific columns from a table, while the TRUNCATE statement is used to remove all columns from a table.", "ansd":"The DELETE statement is used to remove all rows from a table, while the TRUNCATE statement is used to remove all data from a table without removing the table structure.", "category":"SQL", "good_answer":"The DELETE statement is used to remove specific rows from a table based on specified conditions, while the TRUNCATE statement is used to remove all rows from a table.", "level":"EASY", "question":"What is the difference between DELETE and TRUNCATE statements in SQL?", "explanation":"In SQL, both the DELETE and TRUNCATE statements are used to remove data from a table, but they have some important differences: - DELETE Statement: - The DELETE statement is used to remove rows from a table based on specified conditions. - It is a DML (Data Manipulation Language) statement and can be rolled back using the ROLLBACK command if executed within a transaction. - DELETE statement locks each row during the deletion process, which can cause performance issues for large tables or in high-concurrency environments. - DELETE statement can have a WHERE clause to specify which rows to delete, allowing for selective deletion. - DELETE statement triggers any associated triggers or constraints (e.g., ON DELETE CASCADE) defined on the table. - TRUNCATE Statement: - The TRUNCATE statement is used to remove all rows from a table. - It is a DDL (Data Definition Language) statement and cannot be rolled back. Once executed, the data is permanently removed from the table. - TRUNCATE statement locks the entire table and deallocates the data pages, which makes it faster than DELETE for large tables. - TRUNCATE statement does not allow for a WHERE clause, so it removes all rows from the table. - TRUNCATE statement resets the identity seed value of the table, if it exists. - TRUNCATE statement does not trigger any associated triggers or constraints. In summary, DELETE is used for selective row deletion with the ability to roll back changes, while TRUNCATE is used for fast removal of all rows from a table without the ability to roll back changes."},
 {"id":59, "ansa":"A shell is a graphical user interface used in Linux for interacting with the operating system.", "ansb":"A shell is a command-line interpreter that provides a user interface for accessing the operating system's services.", "ansc":"A shell is a software application used for creating virtual environments in Linux.", "ansd":"A shell is a hardware component used for storing temporary data in Linux.", "category":"LINUX", "good_answer":"A shell is a command-line interpreter that provides a user interface for accessing the operating system's services.", "level":"EASY", "question":"What is a shell in Linux?", "explanation":"In Linux, a shell serves as a command-line interface (CLI) or interpreter that facilitates user interaction with the operating system. It interprets commands entered by users, executing them to perform various tasks such as file management, process control, and system configuration. Shells support scripting, enabling users to automate tasks by creating scripts containing sequences of commands. Additionally, users can customize their shell environments by configuring settings like prompt appearance, environment variables, and command aliases. Job control features allow users to manage multiple processes, run commands in the background, and switch between foreground and background tasks. Popular shells in Linux include Bash, Zsh, and Fish, each offering unique features and capabilities to enhance user experience and productivity."},
 {"id":60, "ansa":"The root user is a regular user with limited privileges in Linux.", "ansb":"The root user is a special user with administrative privileges in Linux, also known as the superuser.", "ansc":"The root user is a guest user with read-only access to the system in Linux.", "ansd":"The root user is a system process responsible for managing hardware resources in Linux.", "category":"LINUX", "good_answer":"The root user is a special user with administrative privileges in Linux, also known as the superuser.", "level":"EASY", "question":"What is the root user in Linux?", "explanation":"In Linux, the root user is the superuser or administrator account that has full control over the system. The root user has unrestricted access to all files, commands, and system resources, making it the most powerful user account on the system. Key characteristics of the root user include: - Unrestricted Access: The root user can perform any operation on the system, including modifying system files, installing and removing software, and managing user accounts. - Highest Privileges: The root user has the highest level of privileges, allowing it to execute commands with elevated permissions, bypassing most security restrictions. - Responsibility: With great power comes great responsibility. The root user is responsible for maintaining the security and integrity of the system, as well as ensuring that system configurations and changes are made carefully and judiciously. - Security Risks: Because the root user has unrestricted access to the system, it poses a significant security risk if accessed by unauthorized users or if used carelessly. It is essential to exercise caution when using the root account and to follow best practices for securing the root user's access. To perform administrative tasks that require root privileges, regular users can use the sudo command to temporarily elevate their permissions. This allows them to execute specific commands as the root user while maintaining their regular user privileges for most operations, helping to mitigate the security risks associated with constant root access."},
 {"id":61, "ansa":"A symbolic link is a file that contains binary data representing another file or directory in Linux.", "ansb":"A symbolic link is a file that contains a reference to another file or directory in Linux, acting as a shortcut.", "ansc":"A symbolic link is a process used for creating virtual environments in Linux.", "ansd":"A symbolic link is a command used for encrypting files in Linux.", "category":"LINUX", "good_answer":"A symbolic link is a file that contains a reference to another file or directory in Linux, acting as a shortcut.", "level":"EASY", "question":"What is a symbolic link in Linux?", "explanation":"In Linux, a symbolic link, also known as a symlink or soft link, is a special type of file that points to another file or directory in the filesystem. Unlike a hard link, which directly points to the inode of the target file or directory, a symbolic link contains the path to the target file or directory. Key characteristics of symbolic links include: - Path-based Reference: A symbolic link contains the path to the target file or directory rather than directly referencing its inode. This means that if the target file or directory is moved or renamed, the symbolic link will still point to it as long as the path remains valid. - Different File Types: Symbolic links can point to regular files, directories, or even other symbolic links. This flexibility allows for the creation of complex directory structures and facilitates organization and management of files and directories. - Cross-filesystem Support: Symbolic links can span filesystem boundaries, allowing them to point to files or directories located on different filesystems. - Visible Indication: Symbolic links are displayed as distinct files in the filesystem, and their target paths can be viewed using commands like ls or readlink. Symbolic links are commonly used for various purposes in Linux, such as creating shortcuts to files or directories, providing alternative names for files or directories, and facilitating compatibility between different filesystems or directory structures. They offer flexibility and convenience in managing filesystem resources."},
 {"id":62, "ansa":"A package manager is a graphical user interface used in Linux for interacting with the operating system.", "ansb":"A package manager is a command-line tool used for installing, updating, and removing software packages in Linux.", "ansc":"A package manager is a software application used for managing hardware resources in Linux.", "ansd":"A package manager is a system process responsible for managing system services in Linux.", "category":"LINUX", "good_answer":"A package manager is a command-line tool used for installing, updating, and removing software packages in Linux.", "level":"EASY", "question":"What is a package manager in Linux?", "explanation":"In Linux, a package manager is a tool used to automate the installation, upgrade, configuration, and removal of software packages. It maintains a centralized repository of packages, resolves dependencies, manages versions, distributes security updates, and ensures consistent configuration across systems. Popular examples include APT, YUM, DNF, Pacman, and ZYpp."},
 {"id":63, "ansa":"The grep command is used for compressing files in Linux.", "ansb":"The grep command is used for creating symbolic links in Linux.", "ansc":"The grep command is used for searching text patterns in files in Linux.", "ansd":"The grep command is used for managing user permissions in Linux.", "category":"LINUX", "good_answer":"The grep command is used for searching text patterns in files in Linux.", "level":"EASY", "question":"What is the purpose of the grep command in Linux?", "explanation":"In Linux, the `grep` command is used to search for specific patterns or strings within files. Its primary purpose is to scan text data and display lines that match a specified pattern or regular expression. Key uses of the `grep` command include: - Pattern Matching: `grep` allows users to search for specific patterns or strings within one or multiple files. It supports simple string matching as well as more complex regular expressions. - File Filtering: Users can use `grep` to filter lines in files based on specific criteria, such as searching for lines containing a particular word or excluding lines that match a pattern. - Text Extraction: `grep` can extract lines from files that match a specified pattern and display them on the terminal or redirect them to another file. - Recursive Search: With the `-r` or `-R` option, `grep` can recursively search through directories and subdirectories to find matching patterns within files. Overall, the `grep` command is a powerful and versatile tool for searching and extracting text data in Linux, making it invaluable for tasks such as log analysis, data processing, and system administration."},
 {"id":64, "ansa":"Spring Framework is a lightweight framework for building enterprise applications in Java.", "ansb":"Spring Framework is a programming language for web development.", "ansc":"Spring Framework is a database management system.", "ansd":"Spring Framework is a content management system.", "category":"SPRING", "good_answer":"Spring Framework is a lightweight framework for building enterprise applications in Java.", "level":"EASY", "question":"What is Spring Framework?", "explanation":"The Spring Framework is a comprehensive open-source framework for building enterprise Java applications. It provides a wide range of features and functionalities to simplify the development of Java applications, particularly web applications and microservices."},
