 {"id":85, "ansa":"@Autowired is specific to Spring, whereas @Inject is a standard Java annotation for dependency injection.", "ansb":"@Autowired allows optional dependency injection, while @Inject does not support optional dependencies.", "ansc":"@Inject can be used for method injection only, whereas @Autowired can be used for fields, setters, and constructors.", "ansd":"@Autowired is deprecated and should not be used, while @Inject is the recommended approach.", "category":"SPRING", "good_answer":"@Autowired is specific to Spring, whereas @Inject is a standard Java annotation for dependency injection.", "level":"EASY", "question":"What is the difference between the @Autowired and @Inject annotations?", "explanation":"The main difference between @Autowired and @Inject lies in their origin: @Autowired is a Spring-specific annotation, while @Inject is defined by JSR-330 and is not Spring-specific. Both can be used for autowiring dependencies, but @Autowired comes with additional features, such as the 'required' attribute that allows defining whether a bean is mandatory. In contrast, @Inject does not have this feature and always expects the dependency to be present."},
 {"id":86, "ansa":"No, it is not mandatory if the class has only one constructor.", "ansb":"Yes, it is always required to indicate constructor injection.", "ansc":"No, but omitting it will result in the default constructor being used instead.", "ansd":"Yes, unless using another form of dependency injection like field injection.", "category":"SPRING", "good_answer":"No, it is not mandatory if the class has only one constructor.", "level":"EASY", "question":"Is the @Autowired annotation mandatory when using constructor injection?", "explanation":"In Spring, the @Autowired annotation is not mandatory for constructor injection if the target component has only one constructor. Spring will use that constructor for dependency injection by default. However, if there are multiple constructors and you want to use a specific one for dependency injection, you must annotate it with @Autowired."},
 {"id":87, "ansa":"Using the @Value annotation with the property name in the Spring expression language.", "ansb":"Using the @PropertySource annotation on the class to specify the property file.", "ansc":"Using the @Autowired annotation on the field that should be injected with the property.", "ansd":"Using the @Inject annotation with the property name to inject the value.", "category":"SPRING", "good_answer":"Using the @Value annotation with the property name in the Spring expression language.", "level":"MEDIUM", "question":"How can we inject the value of a property, for example, spring.datasource.url?", "explanation":"To inject the value of a property like 'spring.datasource.url' in Spring, you can use the @Value annotation. You would typically provide the property name within the annotation, like @Value(\"${spring.datasource.url}\"). This tells Spring to inject the corresponding value from the application's property files into the annotated field or method parameter."},
 {"id":88, "ansa":"It marks a method to be executed after dependency injection is complete, but before the bean is used.", "ansb":"It indicates that a method should be run before the servlet container is destroyed.", "ansc":"It designates a method that should be executed before the bean's properties are set.", "ansd":"It specifies a callback method to be invoked before a bean is made persistent.", "category":"SPRING", "good_answer":"It marks a method to be executed after dependency injection is complete, but before the bean is used.", "level":"EASY", "question":"What is the purpose of the @PostConstruct annotation?", "explanation":"The @PostConstruct annotation is used on a method that needs to be executed after dependency injection is complete to perform any initialization. This callback method will be invoked only once, just after the bean's properties have been injected but before the bean is put into service. It is often used for setup tasks that depend on dependency injection."},
 {"id":89, "ansa":"It indicates that a component is only eligible for registration when one or more specified profiles are active.", "ansb":"It defines the runtime performance profile for the application to optimize its execution.", "ansc":"It specifies the database profile to be used for data-related operations in the application.", "ansd":"It sets the user profile information for the application's security context.", "category":"SPRING", "good_answer":"It indicates that a component is only eligible for registration when one or more specified profiles are active.", "level":"MEDIUM", "question":"What is the purpose of the @Profile annotation?", "explanation":"The @Profile annotation in Spring is used to indicate that a bean is only eligible for registration if one or more specified profiles are active. This feature allows developers to segregate parts of the application configuration and make it only available in certain environments, for example, 'dev', 'test', or 'prod'. Using @Profile, you can easily switch between different configurations depending on the active profile."},
 {"id":90, "ansa":"@Qualifier specifies which bean to inject when multiple candidates are present; @Primary indicates the default bean to use. @Qualifier has precedence.", "ansb":"@Primary is used to define a primary data source; @Qualifier is used to specify a secondary data source. @Primary has precedence.", "ansc":"@Qualifier is used to document the purpose of a bean; @Primary is used to mark a bean for eager initialization. @Qualifier has precedence.", "ansd":"@Primary is used to identify a high-priority bean for autowiring; @Qualifier is used for grouping similar beans. @Primary has precedence.", "category":"SPRING", "good_answer":"@Qualifier specifies which bean to inject when multiple candidates are present; @Primary indicates the default bean to use. @Qualifier has precedence.", "level":"MEDIUM", "question":"What is the difference between the @Qualifier and @Primary annotations, and which one takes precedence?", "explanation":"The @Qualifier annotation is used to resolve the autowiring conflict when there are multiple beans of the same type. It allows specifying which bean should be injected by its name. On the other hand, @Primary is used when you need to give a bean priority when Spring looks for beans of a particular type. In cases where both @Primary and @Qualifier annotations are applied, @Qualifier takes precedence, allowing for more specific wiring selections."},
 {"id":91, "ansa":"It is a front controller in the Spring MVC framework that dispatches requests to the appropriate handlers.", "ansb":"It is a servlet that directly handles all incoming HTTP requests and generates responses.", "ansc":"It is a data access object that interacts with the database to retrieve or update information.", "ansd":"It is a component that manages security and authentication in Spring applications.", "category":"SPRING", "good_answer":"It is a front controller in the Spring MVC framework that dispatches requests to the appropriate handlers.", "level":"EASY", "question":"What is DispatcherServlet?", "explanation":"DispatcherServlet acts as the front controller in the Spring MVC framework. It is the central servlet that receives incoming HTTP requests and delegates them to the appropriate handlers (controllers), which then return a response. The DispatcherServlet coordinates the various components of the Spring MVC framework, such as controllers, view resolvers, and handler mappings, ensuring a cohesive workflow from request to response."},
 {"id":92, "ansa":"No, it will cause a conflict as Spring cannot differentiate between the two methods with the same request mapping.", "ansb":"Yes, as long as they accept different query parameters.", "ansc":"Yes, if one method returns a ModelAndView object and the other returns a ResponseEntity.", "ansd":"No, unless they are mapped to different HTTP methods.", "category":"SPRING", "good_answer":"No, it will cause a conflict as Spring cannot differentiate between the two methods with the same request mapping.", "level":"EASY", "question":"Can we have two methods in a controller annotated with @GetMapping and the same path, e.g., /number?", "explanation":"In Spring MVC, having two controller methods with the same path and HTTP method annotated with @GetMapping would result in an ambiguity error. Spring needs to be able to distinguish between different mappings uniquely. If two methods are mapped to the same URL path and HTTP method, Spring cannot determine which one to call during a request, leading to a runtime exception."},
 {"id":93, "ansa":"@PathVariable is used to extract values from the URI path, while @RequestParam is used to read HTTP request parameters.", "ansb":"@PathVariable is used for configuring application settings, while @RequestParam is used for form data.", "ansc":"@RequestParam is used to extract values from the request body, while @PathVariable is used for headers.", "ansd":"@PathVariable is only applicable for POST requests, whereas @RequestParam is used for GET requests.", "category":"SPRING", "good_answer":"@PathVariable is used to extract values from the URI path, while @RequestParam is used to read HTTP request parameters.", "level":"EASY", "question":"What is the difference between @PathVariable and @RequestParam annotations?", "explanation":"The @PathVariable annotation is used to bind a method parameter to a URI template variable. It's most commonly used in RESTful web services where the URL contains a path variable. For example, in '/users/{userId}', {userId} can be bound to a method parameter using @PathVariable. On the other hand, @RequestParam is used to access the query parameters from the HTTP request. For example, in the URL '/users?userId=123', 'userId' is a query parameter that can be accessed using @RequestParam."},
 {"id":94, "ansa":"Technically yes, but it violates the principles of REST and is not recommended.", "ansb":"No, it's impossible to map DELETE to create operations in any framework or protocol.", "ansc":"Yes, DELETE can be universally used for any operation, including adding users.", "ansd":"No, because DELETE requests cannot contain a request body, making it unsuitable for adding users.", "category":"SPRING", "good_answer":"Technically yes, but it violates the principles of REST and is not recommended.", "level":"MEDIUM", "question":"Can we map the HTTP DELETE method to add users to the database?", "explanation":"While you technically can map a DELETE request to perform an add operation in your backend, it goes against the conventions and principles of RESTful design. In REST, each HTTP method has a specific, standard purpose: GET is for retrieving data, POST is for creating data, PUT and PATCH are for updating, and DELETE is for removing data. Mapping DELETE to add users would be confusing and misleading, reducing the clarity and maintainability of your API."},
 {"id":95, "ansa":"Filter is a servlet concept that can modify request and response objects, while HandlerInterceptor is specific to Spring MVC and can act pre and post-controller execution.", "ansb":"Filter is used only for modifying request headers, while HandlerInterceptor can modify request and response bodies.", "ansc":"HandlerInterceptor is a Java EE standard, while Filter is a Spring-specific feature.", "ansd":"Filter can only be used to log requests and responses, whereas HandlerInterceptor can change the execution flow.", "category":"SPRING", "good_answer":"Filter is a servlet concept that can modify request and response objects, while HandlerInterceptor is specific to Spring MVC and can act pre and post-controller execution.", "level":"MEDIUM", "question":"How do Filter and HandlerInterceptor differ?", "explanation":"Filters in Java Servlet technology are used to perform filtering tasks on either the request to a resource (a servlet or static content), or on the response from a resource, or both. They are not tied to Spring and can be used in any Java web application. In contrast, HandlerInterceptor is specific to Spring MVC and provides more fine-grained control over the handling of requests and responses. Interceptors can execute code before a controller method is invoked (preHandle), after the controller method returns but before the view is rendered (postHandle), and after the request is complete (afterCompletion)."},
 {"id":96, "ansa":"It is used to handle exceptions within a specific controller, and yes, it can be used globally with @ControllerAdvice.", "ansb":"It is for exception logging only and cannot be used globally.", "ansc":"It is used to define fallback methods for failed transactions and cannot be applied globally.", "ansd":"It is to handle only unchecked exceptions and can be used globally by annotating a service class with it.", "category":"SPRING", "good_answer":"It is used to handle exceptions within a specific controller, and yes, it can be used globally with @ControllerAdvice.", "level":"EASY", "question":"What is the purpose of the @ExceptionHandler annotation, and can we use it globally for all controllers?", "explanation":"The @ExceptionHandler annotation is used to define methods in your controller that will serve as exception handlers for specific exceptions thrown by request-handling methods within the same controller. To apply exception handling globally across all controllers, you can use @ExceptionHandler in combination with the @ControllerAdvice annotation. By annotating a class with @ControllerAdvice, you make its @ExceptionHandler methods applicable to all controllers, effectively handling exceptions globally."},
 {"id":97, "ansa":"Yes, it applies globally to all controllers within the application.", "ansb":"No, it only applies to the controller within the same package.", "ansc":"No, it is limited to the controller explicitly defined in the advice.", "ansd":"Yes, but only if the controllers are annotated with a specific custom annotation.", "category":"SPRING", "good_answer":"Yes, it applies globally to all controllers within the application.", "level":"EASY", "question":"Does exception handling in a component annotated with @ControllerAdvice apply to all controllers?", "explanation":"A class annotated with @ControllerAdvice in Spring MVC acts as a global exception handler, applying to all controllers across the application. It allows you to handle exceptions across multiple controllers in a centralized manner. When an exception is thrown by any controller, the exception handling methods defined in the @ControllerAdvice component will be considered for handling that exception."},
 {"id":98, "ansa":"Database migration mechanisms are needed to manage and apply version control to the database schema. Spring Boot supports Flyway and Liquibase for this purpose.", "ansb":"Migration mechanisms are primarily for data backup purposes. Spring Boot uses Hibernate and JPA for this.", "ansc":"They are used to synchronize databases across different environments. Spring Boot recommends using JDBC and JdbcTemplate.", "ansd":"Migration tools are only needed for noSQL databases. Spring Boot integrates with MongoDB and Cassandra for these operations.", "category":"SPRING", "good_answer":"Database migration mechanisms are needed to manage and apply version control to the database schema. Spring Boot supports Flyway and Liquibase for this purpose.", "level":"MEDIUM", "question":"Why do we need a database migration mechanism, and what tools does Spring Boot support for this purpose?", "explanation":"Database migration mechanisms are essential for evolving your database schema while keeping it synchronized with the application's codebase. They help in tracking changes, applying consistent updates across different environments, and facilitating team collaboration. Spring Boot supports tools like Flyway and Liquibase, which provide robust mechanisms for versioning, tracking, and applying database schema changes."},
 {"id":99, "ansa":"Yes, JpaRepository is parameterized and requires two parameters: the entity class and the type of its primary key.", "ansb":"No, JpaRepository is not parameterized and does not require any type parameters.", "ansc":"Yes, it requires only one parameter: the entity class.", "ansd":"Yes, it requires three parameters: the entity class, the primary key type, and the transaction manager.", "category":"SPRING", "good_answer":"Yes, JpaRepository is parameterized and requires two parameters: the entity class and the type of its primary key.", "level":"EASY", "question":"Is the JpaRepository interface parameterized? If so, what type parameters does it require?", "explanation":"The JpaRepository interface in Spring Data JPA is indeed parameterized. It requires two type parameters: the first one is the entity class that the repository will manage, and the second one is the datatype of the entity's primary key. This parameterization allows the JpaRepository to provide CRUD operations and queries specific to the entity type."},
 {"id":100, "ansa":"It simplifies database interaction, abstracting boilerplate code like opening connections, executing SQL queries, and handling exceptions.", "ansb":"It serves as a template for defining JDBC transactions, managing only transaction boundaries.", "ansc":"It is used exclusively for ORM (Object-Relational Mapping) to map Java objects to database tables.", "ansd":"It is a utility class that provides methods for configuring the connection pool in Spring applications.", "category":"SPRING", "good_answer":"It simplifies database interaction, abstracting boilerplate code like opening connections, executing SQL queries, and handling exceptions.", "level":"EASY", "question":"What is the purpose of the JdbcTemplate class?", "explanation":"The JdbcTemplate class in Spring is a helper class that simplifies the interaction with the database through JDBC. It eliminates the need to write repetitive code for opening and closing connections, executing SQL queries, iterating over result sets, and handling exceptions. JdbcTemplate manages these tasks internally, providing a more streamlined and efficient way to interact with a database."},
 {"id":101, "ansa":"Transaction isolation levels define the degree to which a transaction must be isolated from data modifications made by other transactions. Levels include READ UNCOMMITTED, READ COMMITTED, REPEATABLE READ, and SERIALIZABLE.", "ansb":"They are settings that determine the visibility of temporary tables in a transaction. The only levels are TEMPORARY and PERMANENT.", "ansc":"Isolation levels are methods to lock a database. The two levels are SHARED LOCK and EXCLUSIVE LOCK.", "ansd":"These levels dictate the speed of transactions, including FAST, MEDIUM, and SLOW.", "category":"SPRING", "good_answer":"Transaction isolation levels define the degree to which a transaction must be isolated from data modifications made by other transactions. Levels include READ UNCOMMITTED, READ COMMITTED, REPEATABLE READ, and SERIALIZABLE.", "level":"MEDIUM", "question":"What are transaction isolation levels? List and briefly discuss them.", "explanation":"Transaction isolation levels are crucial in concurrent database environments, determining how changes made by one transaction are visible to others. READ UNCOMMITTED allows seeing uncommitted changes, leading to dirty reads. READ COMMITTED avoids dirty reads by only showing data committed before the start of the transaction. REPEATABLE READ ensures consistency by preventing reads of data changed during the transaction, but not new data. SERIALIZABLE is the strictest level, serializing access to prevent concurrent transactions from affecting each other, eliminating dirty reads, non-repeatable reads, and phantom reads."},
 {"id":102, "ansa":"Spring supports propagation types like REQUIRED, SUPPORTS, MANDATORY, REQUIRES_NEW, NOT_SUPPORTED, NEVER, and NESTED.", "ansb":"Spring offers only two types: SIMPLE and COMPLEX, for managing transaction boundaries.", "ansc":"There are only global and local transactions in Spring, no specific propagation types.", "ansd":"Spring transaction propagation includes ASYNC and SYNC types, determining execution nature.", "category":"SPRING", "good_answer":"Spring supports propagation types like REQUIRED, SUPPORTS, MANDATORY, REQUIRES_NEW, NOT_SUPPORTED, NEVER, and NESTED.", "level":"MEDIUM", "question":"What types of transaction propagation are available in Spring?", "explanation":"Spring provides several transaction propagation behaviors to manage how transactions relate to each other. REQUIRED is the default and supports joining an existing transaction or starting a new one if none exists. SUPPORTS will execute within an existing transaction but does not start a new one if it's not already present. MANDATORY requires an existing transaction and throws an exception if none is found. REQUIRES_NEW always starts a new transaction, suspending the current one if necessary. NOT_SUPPORTED executes outside a transaction and suspends any existing one. NEVER ensures that no transaction exists, throwing an exception if there is one. NESTED starts a nested transaction if one is already present, allowing for independent inner transaction scopes within an outer transaction."},
 {"id":103, "ansa":"Yes, a rollback will occur if an unchecked exception is thrown within the method.", "ansb":"No, Spring transactions do not support rollback on exceptions.", "ansc":"A rollback will only occur if the exception is explicitly caught and handled within the method.", "ansd":"Rollback behavior depends on the type of exception; only SQLExceptions trigger a rollback.", "category":"SPRING", "good_answer":"Yes, a rollback will occur if an unchecked exception is thrown within the method.", "level":"EASY", "question":"If an exception is thrown during the processing of a method annotated with @Transactional, will a rollback occur?", "explanation":"In Spring, when a method annotated with @Transactional throws a runtime (unchecked) exception, it triggers a rollback of the transaction. However, if a checked exception is thrown, it does not automatically result in a rollback unless it has been explicitly configured to do so using the 'rollbackFor' attribute of the @Transactional annotation. This behavior ensures that the database state remains consistent and not partially updated due to an error during the transaction."},
 {"id":104, "ansa":"We can publish an event using the ApplicationEventPublisher interface by creating a custom event extending ApplicationEvent and publishing it with the publishEvent method.", "ansb":"Events in Spring are published by annotating methods with @PublishEvent and letting Spring handle the distribution.", "ansc":"Spring requires manual propagation of events through the ApplicationContext without any specific interfaces.", "ansd":"We use the @EventPublisher annotation on a class to automatically publish all its methods as events.", "category":"SPRING", "good_answer":"We can publish an event using the ApplicationEventPublisher interface by creating a custom event extending ApplicationEvent and publishing it with the publishEvent method.", "level":"MEDIUM", "question":"How can we publish an event in Spring?", "explanation":"In Spring, you can publish custom events using the ApplicationEventPublisher interface. First, you define your event class, typically extending ApplicationEvent. Then, in your component, you inject the ApplicationEventPublisher and use its publishEvent() method to publish your custom event. Listeners that are annotated with @EventListener and configured to listen for your event type will then react to the event."},
 {"id":105, "ansa":"Such a method can return a value, which will be treated as a new event and published by Spring.", "ansb":"Methods annotated with @EventListener must always return void to avoid confusion in the event handling flow.", "ansc":"They can return a value, but it will be ignored by Spring, resulting in potential performance drawbacks.", "ansd":"Returning a value from an @EventListener method will throw an exception as it violates Spring's event handling conventions.", "category":"SPRING", "good_answer":"Such a method can return a value, which will be treated as a new event and published by Spring.", "level":"MEDIUM", "question":"Can a method annotated with @EventListener return a value, or does it have to be void? What are the implications?", "explanation":"Methods annotated with @EventListener in Spring can return a value, and if they do, the returned value is treated as a new event and gets published within the application context. This feature allows for a chain of events where one event can trigger another. However, it's essential to use this feature judiciously to avoid unexpected behaviors and maintain clear event flows in your application."},
 {"id":106, "ansa":"Spring uses ConcurrentMapCacheManager as the default CacheManager if no other is defined.", "ansb":"EhCacheCacheManager is the default CacheManager in Spring for caching operations.", "ansc":"Spring's default CacheManager is the JCacheCacheManager, aligning with JSR-107.", "ansd":"RedisCacheManager is used by Spring as the default cache manager for its caching support.", "category":"SPRING", "good_answer":"Spring uses ConcurrentMapCacheManager as the default CacheManager if no other is defined.", "level":"EASY", "question":"What CacheManager does Spring use by default?", "explanation":"In the absence of any specific caching configuration, Spring falls back to using ConcurrentMapCacheManager as its default CacheManager. This implementation is straightforward, utilizing a ConcurrentHashMap for storing cache entries and does not require any external dependencies, making it a simple solution for caching needs without any complex setup or external cache stores."},
