[{"id":4, "ansa":"Runtime environment for executing Java code on various platforms.", "ansb":"Debugging tool for Java code.", "ansc":"Java code editor.", "ansd":"Java framework for creating user interfaces.", "category":"GIT", "good_answer":"Runtime environment for executing Java code on various platforms.", "level":"MEDIUM", "question":"What is Java Virtual Machine (JVM)?", "explanation":"The Java Virtual Machine (JVM) is an integral part of the Java runtime environment. It is the engine that enables Java applications to run on any device or operating system, providing the 'write once, run anywhere' capability that Java is known for. \n\nEssentially, the JVM is an abstract computing machine that enables a computer to run a Java program.When a Java program is compiled, it is transformed into bytecode, a platform-independent code that can be executed on any device equipped with a JVM. This feature is what makes Java programs highly portable. The JVM interprets this bytecode and translates it into machine-specific instructions that can be executed by the underlying hardware. The JVM performs several other critical functions, such as memory management, garbage collection, and providing a secure execution environment. Memory management ensures that objects are allocated and de-allocated efficiently, while garbage collection automatically removes objects that are no longer needed, freeing up memory and preventing memory leaks. Moreover, the JVM plays a crucial role in the performance of Java applications. It includes a Just-In-Time (JIT) compiler that converts bytecode into native machine code at runtime, improving the performance of Java applications by making them run faster. \n\nIn summary, the JVM is a cornerstone of the Java programming language, enabling it to function as a cross-platform, high-performance, and secure programming environment. Understanding the JVM's workings and capabilities is essential for any Java developer to fully leverage the strengths of Java in application development."},
 {"id":5, "ansa":"Using the keyword 'define'.", "ansb":"Using the keyword 'class'.", "ansc":"By using the '%' sign.", "ansd":"Classes cannot be defined in Java.", "category":"JAVA", "good_answer":"Using the keyword 'class'.", "level":"EASY", "question":"How do you define a class in Java?", "explanation":"In Java, a class is defined using the class keyword followed by the class name and a pair of curly braces. Inside these braces, you can define fields (attributes) and methods (functions or behaviors). Classes serve as blueprints for creating objects (instances of that class) and can include a special type of method called a constructor, which is used for initializing new objects."},
 {"id":6, "ansa":"A class is an abstract concept, while an object is a concrete instance of a class.", "ansb":"A class is an interface, while an object is an implementation.", "ansc":"A class can be inherited, but an object cannot.", "ansd":"There is no difference between them.", "category":"LINUX", "good_answer":"A class is an abstract concept, while an object is a concrete instance of a class.", "level":"MEDIUM", "question":"What is the difference between a class and an object in Java?", "explanation":"A class in Java is a blueprint from which individual objects are created. It defines a data structure, including fields (attributes) and methods (behaviors). An object, on the other hand, is an instance of a class created with specific values for its attributes and the ability to execute its methods. While a class is a conceptual model, an object is a tangible entity in the program."},
 {"id":7, "ansa":"A method used for destroying objects.", "ansb":"A method used for initializing objects.", "ansc":"A special class used for managing other classes.", "ansd":"Another term for describing an interface in Java.", "category":"JAVA", "good_answer":"A method used for initializing objects.", "level":"EASY", "question":"What is a constructor in Java?", "explanation":"A constructor in Java is a special type of method used to initialize objects. It is called when an instance of a class is created. Constructors have the same name as the class and do not have a return type. They can be overloaded to allow objects to be initialized in different ways."},
 {"id":8, "ansa":"Data collections.", "ansb":"Control statements used for repeating blocks of code.", "ansc":"Java classes.", "ansd":"Special data types.", "category":"JAVA", "good_answer":"Control statements used for repeating blocks of code.", "level":"EASY", "question":"What are loops in Java?", "explanation":"Loops in Java are used to execute a block of code repeatedly based on a given condition. There are three main types of loops: for, while, and do-while. The for loop is used when the number of iterations is known. The while loop and do-while loop are used when the number of iterations is not known ahead of time, with the do-while loop executing its block at least once."},
 {"id":9, "ansa":"A class that implements other classes.", "ansb":"A special class that inherits from other classes.", "ansc":"A constructor used to implement abstract classes.", "ansd":"A class that defines methods but does not contain their implementation.", "category":"JAVA", "good_answer":"A class that defines methods but does not contain their implementation.", "level":"EASY", "question":"What is an interface in Java?", "explanation":"An interface in Java is a reference type that can contain only constants, method signatures, default methods, static methods, and nested types. It is a way to achieve abstraction and multiple inheritance in Java. Classes \"implement\" interfaces, obligating them to provide implementations for the interface's abstract methods."},
 {"id":10, "ansa":"Errors occurring during the compilation of Java code.", "ansb":"Special types of objects used for handling runtime errors.", "ansc":"Data types used for handling multidimensional arrays.", "ansd":"Conditional statements.", "category":"JAVA", "good_answer":"Special types of objects used for handling runtime errors.", "level":"EASY", "question":"What are exceptions in Java?", "explanation":"Exceptions in Java are events that disrupt the normal flow of the program's instructions. They are objects that wrap an error event that occurred within a method and contains information about the error including its type and the state of the program when the error occurred. Java has a robust system for handling exceptions, allowing developers to manage errors gracefully and maintain the flow of the application."},
 {"id":11, "ansa":"int, float, char, boolean.", "ansb":"String, double, byte, long.", "ansc":"Integer, Float, Character, Boolean.", "ansd":"Short, double, boolean, string.", "category":"JAVA", "good_answer":"int, float, char, boolean.", "level":"EASY", "question":"What are the primitive data types in Java?", "explanation":"Java has eight primitive data types: byte, short, int, long, float, double, boolean, and char. These types represent single values and are not objects. They are the building blocks for data manipulation in Java, allowing for efficient processing and "},
 {"id":12, "ansa":"A variable is an object of a class.", "ansb":"A variable is a reserved keyword.", "ansc":"A variable is a symbol representing a location in computer memory where data can be stored.", "ansd":"A variable is a method.", "category":"JAVA", "good_answer":"A variable is a symbol representing a location in computer memory where data can be stored.", "level":"EASY", "question":"What is a variable in Java?", "explanation":"A variable in Java is a piece of memory that can contain a data value. A variable thus has a data type, a name, and a value. The data type determines what kind of values the variable can hold, such as integers, floating-point numbers, characters, or booleans."},
 {"id":13, "ansa":"Using the 'Array' class.", "ansb":"By using the '=' operator.", "ansc":"Using the 'array' keyword.", "ansd":"By using square brackets '[' and ']'.", "category":"JAVA", "good_answer":"By using square brackets '[' and ']'.", "level":"EASY", "question":"How do you define an array in Java?", "explanation":"In Java, an array is defined by specifying the data type of its elements followed by square brackets. The elements in an array are stored in contiguous memory locations. Arrays are fixed in size, and the elements can be accessed by their index, which starts from 0."},
 {"id":14, "ansa":"Another term for describing a class in Java.", "ansb":"A variable defined within a class.", "ansc":"A conditional statement.", "ansd":"A piece of code that performs a specific task and can be called within a program.", "category":"JAVA", "good_answer":"A piece of code that performs a specific task and can be called within a program.", "level":"EASY", "question":"What is a method in Java?", "explanation":"A method in Java is a block of code that performs a specific task. A method can have parameters and can return a value. Methods are defined within classes and are used to express behaviors of objects."},
 {"id":15, "ansa":"An abstract class can have method implementations, whereas an interface cannot.", "ansb":"An interface can inherit from other interfaces, whereas an abstract class cannot.", "ansc":"An abstract class cannot have constructors, whereas an interface can.", "ansd":"There are no differences between them.", "category":"JAVA", "good_answer":"An abstract class can have method implementations, whereas an interface cannot.", "level":"EASY", "question":"What are the differences between an abstract class and an interface in Java?", "explanation":"n Java, an abstract class can have both abstract and concrete methods, providing a partial implementation. Interfaces, on the other hand, can only have abstract methods (until Java 8 introduced default methods) and are used to specify a set of methods that a class must implement. Abstract classes are used when classes share a common structure or behavior, while interfaces are better for establishing a common API without concerning the underlying implementation."},
 {"id":16, "ansa":"'extends'.", "ansb":"'inherits'.", "ansc":"'implements'.", "ansd":"'inheritsfrom'.", "category":"JAVA", "good_answer":"'extends'.", "level":"MEDIUM", "question":"What keyword do you use to inherit from a class in Java?", "explanation":"In Java, the extends keyword is used for a class to inherit from another class. This mechanism is known as class inheritance, allowing a child class to acquire properties and methods of the parent class, promoting code reusability and polymorphism."},
 {"id":17, "ansa":"Runtime environment for executing Java code on various platforms.", "ansb":"Debugging tool for Java code.", "ansc":"Java code editor.", "ansd":"Java framework for creating user interfaces.", "category":"JAVA", "good_answer":"Runtime environment for executing Java code on various platforms.", "level":"EASY", "question":"What is Java Virtual Machine (JVM)?", "explanation":"Explanation has not been provided"},
 {"id":18, "ansa":"Errors occurring during the compilation of Java code.", "ansb":"Special types of objects used for handling runtime errors.", "ansc":"Data types used for handling multidimensional arrays.", "ansd":"Conditional statements.", "category":"JAVA", "good_answer":"Special types of objects used for handling runtime errors.", "level":"MEDIUM", "question":"What are exceptions in Java?", "explanation":"In Java, exceptions are events that disrupt the normal flow of a program's instructions. They are objects that represent an error or an unusual condition that occurs during the execution of a program. When an error occurs within a method, Java creates an exception object and hands it off to the runtime system. This mechanism is known as \"throwing an exception.\" Java uses a try-catch block to handle exceptions, allowing developers to manage errors gracefully and maintain the normal flow of the application. Exception handling in Java helps in resolving runtime errors and implementing error-handling strategies, thereby enhancing the reliability and robustness of Java applications."},
 {"id":19, "ansa":"Class used for creating objects whose value cannot be changed.", "ansb":"Class used for building and manipulating strings.", "ansc":"Class that allows sorting data.", "ansd":"Class implementing the Comparable interface.", "category":"JAVA", "good_answer":"Class used for building and manipulating strings.", "level":"EASY", "question":"What is StringBuilder in Java?", "explanation":"`StringBuilder` in Java is a mutable sequence of characters. Unlike `String` objects, which are immutable, `StringBuilder` allows for the modification of strings without generating new objects for each modification. This makes `StringBuilder` more efficient for operations that involve frequent modifications to a string, such as concatenation, insertion, or deletion of characters. It provides various methods to manipulate strings, offering better performance when dealing with changeable character sequences, especially in loops or when constructing complex strings."},
 {"id":20, "ansa":"Assignment operator.", "ansb":"Comparison operator.", "ansc":"Addition operator.", "ansd":"Logical 'or' operator.", "category":"JAVA", "good_answer":"Comparison operator.", "level":"EASY", "question":"What is the '==' operator in Java?", "explanation":"In Java, the `==` operator is used to compare primitives and check if they are equal. However, when used with objects, `==` compares their memory addresses, not their contents. For example, when comparing two `String` objects, `==` checks if they refer to the same memory location. To compare the contents of objects for equality, particularly strings, you should use the `.equals()` method instead, which compares the values within the objects."},
 {"id":21, "ansa":"Keyword denoting null value.", "ansb":"Reference to the current object.", "ansc":"Keyword denoting end of program.", "ansd":"Keyword used to terminate loops.", "category":"JAVA", "good_answer":"Reference to the current object.", "level":"EASY", "question":"What is 'this' in Java?", "explanation":"In Java, `this` is a reference variable that refers to the current object. It is used within an instance method or a constructor to refer to the current object on which the method or constructor is being invoked. The `this` keyword is particularly useful for distinguishing between instance variables and parameters with the same name, for passing the current object as a parameter to another method, and for calling another constructor in the same class with different parameters. It helps in making the code more readable and maintaining the context of the current object."},
 {"id":22, "ansa":"while, do-while, until.", "ansb":"for, do-while, foreach.", "ansc":"for, while, do-while.", "ansd":"foreach, until, for.", "category":"JAVA", "good_answer":"for, while, do-while.", "level":"EASY", "question":"What are the three types of loops in Java?", "explanation":"In Java, there are three primary types of loops used to execute a block of code repeatedly: 1. for loop: It executes a block of code a set number of times and is typically used when the number of iterations is known before entering the loop. 2. while loop: It executes a block of code as long as a specified condition is true. The condition is evaluated before entering the loop. 3. do-while loop: Similar to the while loop, but it guarantees the block of code is executed at least once because the condition is evaluated after the code has executed. Each of these loops serves different use cases depending on the conditions and the control required over the iterations."},
 {"id":23, "ansa":"Method used for deleting objects.", "ansb":"Method used for initializing a class.", "ansc":"Method that is the entry point of a program.", "ansd":"Method that is called after initializing a class.", "category":"JAVA", "good_answer":"Method that is the entry point of a program.", "level":"EASY", "question":"What is the 'main' method in Java?", "explanation":"The `main` method in Java is the entry point of any Java program. It's defined as `public static void main(String[] args)`. The `public` modifier makes it accessible from anywhere, `static` allows it to be run without creating an instance of the class, `void` means it doesn't return any value, and `String[] args` is an array of strings that stores command-line arguments. When you run a Java application, the JVM looks for the `main` method to begin execution."},
 {"id":24, "ansa":"Static and non-static methods.", "ansb":"Public and private methods.", "ansc":"Abstract and concrete methods.", "ansd":"Input and output methods.", "category":"LINUX", "good_answer":"Static and non-static methods.", "level":"MEDIUM", "question":"What are the two types of methods in Java?", "explanation":"In Java, methods are generally categorized into two types based on their functionality and interaction with class fields: 1. Instance methods:These methods belong to an instance of a class. They require an object of their class to be created before they can be called. Instance methods can access instance variables and instance methods directly. 2. Static methods: These methods belong to the class rather than any particular instance of the class. They can be called without creating an object of the class. Static methods can access static variables and other static methods directly. The classification is based on whether they require an instance to execute (instance methods) or they can be executed at the class level (static methods)."},
 {"id":25, "ansa":"Statements for handling errors at runtime.", "ansb":"Statements that repeat a block of code a specified number of times.", "ansc":"Statements that perform different actions depending on a condition.", "ansd":"Statements that transfer control to a different place in the program.", "category":"JAVA", "good_answer":"Statements that perform different actions depending on a condition.", "level":"EASY", "question":"What are conditional statements in Java?", "explanation":"Conditional statements in Java are used to execute different blocks of code based on certain conditions. The primary conditional statements are 1. if statement: Executes a block of code if a specified condition is true. 2. if-else statement:** Executes one block of code if the condition is true, and another block if the condition is false. 3. else-if statement: Specifies a new condition to test if the first condition is false. 4. switch statement:** Allows a variable to be tested for equality against a list of values, each with its own block of code to be executed. These structures help control the flow of the program's execution based on the dynamic conditions at runtime."},
 {"id":26, "ansa":"A process of hiding the implementation details of a class and exposing only the necessary features.", "ansb":"A method used for debugging code.", "ansc":"An object-oriented design principle.", "ansd":"A term describing the inheritance of properties and behaviors from one class to another.", "category":"JAVA", "good_answer":"A process of hiding the implementation details of a class and exposing only the necessary features.", "level":"EASY", "question":"What is encapsulation?", "explanation":"Encapsulation in Java is a fundamental principle of object-oriented programming that restricts direct access to an object's data and methods. It is achieved by making the class fields private and providing public getter and setter methods to modify and view the variable values. This approach hides the internal state of an object and protects it from unintended modifications by external code, ensuring the object's integrity and security. Encapsulation also enhances maintainability and flexibility by allowing changes to how data is accessed or modified without affecting external code that depends on the class."},
 {"id":27, "ansa":"A class used for defining abstract classes in Java.", "ansb":"A class used for handling exceptions in Java programs.", "ansc":"A class used for internationalization and localization in Java.", "ansd":"A class used for performing mathematical operations in Java.", "category":"JAVA", "good_answer":"A class used for internationalization and localization in Java.", "level":"MEDIUM", "question":"What is the purpose of the Locale class (and other related classes)?", "explanation":"The `Locale` class in Java is used to tailor program output to the conventions of a particular geographic, political, or cultural region. It affects how your program presents and formats data to the user, particularly in terms of language, country, and variant. Related classes and interfaces, like `NumberFormat` and `DateFormat`, utilize `Locale` to provide locale-specific data formats and representations, enhancing user experience and accessibility by aligning the program's output with local expectations and norms."},
 {"id":28, "ansa":"Using the 'Number' class.", "ansb":"Using the 'digit' keyword.", "ansc":"Using the 'int', 'float', 'double', 'long', etc. data types.", "ansd":"Using the 'NumberFormat' class.", "category":"JAVA", "good_answer":"Using the 'int', 'float', 'double', 'long', etc. data types.", "level":"EASY", "question":"What are the ways to represent a number in the Java language (by specifying it in code)?", "explanation":"In Java, you can represent numbers in various ways while specifying them in code: 1. Decimal (Base 10): Regular integer (e.g., `123`) and floating-point (e.g., `123.45`) numbers. 2. Hexadecimal (Base 16): Prefixed with `0x` or `0X` (e.g., `0xFF`). 3. Octal (Base 8): Prefixed with `0` (e.g., `077`). 4. Binary (Base 2): Prefixed with `0b` or `0B` (e.g., `0b1010`). 5. Scientific Notation: For floating-point numbers (e.g., `1.23e3`). Each representation provides a different way to express numbers, allowing developers to choose the most convenient or clear format for their needs, especially when dealing with different bases or large numbers."},
 {"id":29, "ansa":"A mechanism that allows a class to have multiple constructors.", "ansb":"A method used for converting one data type into another.", "ansc":"A concept that allows objects of different classes to be treated as objects of a common superclass.", "ansd":"A technique used for sorting arrays in Java.", "category":"JAVA", "good_answer":"A concept that allows objects of different classes to be treated as objects of a common superclass.", "level":"MEDIUM", "question":"What is polymorphism?", "explanation":"Polymorphism in Java is a concept where a single interface or method can represent many different underlying forms (types). It's a fundamental principle of object-oriented programming that allows objects of different classes to be treated as objects of a common superclass. Polymorphism can be achieved in Java mainly through two ways: 1. Method Overloading (Compile-time Polymorphism): Multiple methods in the same class share the same name but have different parameters. 2. Method Overriding (Runtime Polymorphism): A subclass provides a specific implementation of a method already defined in its superclass. This concept enables flexibility and reusability of code, allowing you to use a single interface for different underlying data types, enhancing code maintainability and scalability."},
 {"id":30, "ansa":"A List allows duplicate elements and maintains their insertion order, while a Set does not allow duplicate elements and does not maintain any particular order.", "ansb":"A List allows duplicate elements but does not maintain their insertion order, while a Set does not allow duplicate elements but maintains their insertion order.", "ansc":"A List allows duplicate elements and does not maintain any particular order, while a Set does not allow duplicate elements and maintains their insertion order.", "ansd":"There is no difference between a List and a Set.", "category":"JAVA", "good_answer":"A List allows duplicate elements and maintains their insertion order, while a Set does not allow duplicate elements and does not maintain any particular order.", "level":"MEDIUM", "question":"What is the difference between a List and a Set?", "explanation":"In Java, a `List` and a `Set` represent two different types of collections. A `List` is an ordered collection that can contain duplicate elements, and it maintains the insertion order of the elements. You can access elements by their integer index in the list. On the other hand, a `Set` is a collection that cannot contain duplicate elements. It models the mathematical set abstraction and typically does not maintain any specific order of elements. The choice between using a List or a Set depends on the specific requirements regarding order and uniqueness in your application."},
